{
 "generated_utc": "2026-10-27T13:01:09Z",
 "asked": 176,
 "count": 32,
 "pending": [],
 "plain_key_roles": [
  "base:0xbeef010f9cb27031ad51e3333f9af9c6b1228183",
  "ethereum-l1:0x55555815a5595991c3a0ff119b59aef6c8b55555",
  "ethereum-l1:0xa0b86991c6218b36c1d19d4a2e9eb0ce3606eb48",
  "tempo:0x83a1491f3e7f8daab8f787a631334b9ca7a87023"
 ],
 "changes": [],
 "stale": 0,
 "unread_chains": [],
 "previous_run": "2026-10-27T06:57:39Z",
 "by_target": {
  "arbitrum:0x9c4ec768c28520b50860ea7a15bd7213a9ff58bf": {
   "roles": {
    "pauseGuardian()": {
     "kind": "safe",
     "threshold": 5,
     "owners": 9,
     "holder": "0x78e6…1a9d"
    }
   }
  },
  "base:0x420dd381b31aef6683db6b902084cb0ffece40da": {
   "roles": {
    "pauser()": {
     "kind": "safe",
     "threshold": 3,
     "owners": 7,
     "holder": "0xe6a4…2075"
    }
   }
  },
  "base:0xb125e6687d4313864e53df431d5425969c15eb2f": {
   "roles": {
    "pauseGuardian()": {
     "kind": "safe",
     "threshold": 5,
     "owners": 9,
     "holder": "0x3cb4…d2ee"
    }
   }
  },
  "base:0xfbb21d0380bee3312b33c4353c8936a0f13ef26c": {
   "roles": {
    "pauseGuardian()": {
     "kind": "safe",
     "threshold": 2,
     "owners": 4,
     "holder": "0x5b710010586c1b728b047c3e42473c700eea4026"
    }
   }
  },
  "base:0xee8f4ec5672f09119b96ab6fb59c27e1b7e44b61": {
   "roles": {
    "guardian()": {
     "kind": "safe",
     "threshold": 3,
     "owners": 7,
     "holder": "0x7084bf4db6c21e1834dd6482f6056a39a33584cd"
    },
    "curator()": {
     "kind": "safe",
     "threshold": 3,
     "owners": 7,
     "holder": "0x9e33faae38ff641094fa68c65c2ce600b3410585"
    }
   }
  },
  "base:0x7bfa7c4f149e7415b73bdedfe609237e29cbf34a": {
   "roles": {
    "guardian()": {
     "kind": "safe",
     "threshold": 2,
     "owners": 3,
     "holder": "0xf5748bbefa17505b2f7222b23ae11584932c908b"
    },
    "curator()": {
     "kind": "safe",
     "threshold": 2,
     "owners": 2,
     "holder": "0x0f963a8a8c01042b69054e787e5763abbb0646a3"
    }
   }
  },
  "base:0xbeef010f9cb27031ad51e3333f9af9c6b1228183": {
   "roles": {
    "guardian()": {
     "kind": "eoa",
     "holder": "0x9e0f\u2026eaf5"
    },
    "curator()": {
     "kind": "safe",
     "threshold": 3,
     "owners": 9,
     "holder": "0x827e…ecdb"
    }
   }
  },
  "base:0xbeef2d50b428675a1921bc6bbf4bfb9d8cf1461a": {
   "roles": {
    "guardian()": {
     "kind": "contract",
     "holder": "0x491edfb0b8b608044e227225c715981a30f3a44e"
    },
    "curator()": {
     "kind": "safe",
     "threshold": 3,
     "owners": 9,
     "holder": "0x827e…ecdb"
    }
   }
  },
  "ethereum-l1:0xc3d688b66703497daa19211eedff47f25384cdc3": {
   "roles": {
    "pauseGuardian()": {
     "kind": "safe",
     "threshold": 5,
     "owners": 9,
     "holder": "0xbbf3…012c"
    }
   }
  },
  "ethereum-l1:0x55555815a5595991c3a0ff119b59aef6c8b55555": {
   "roles": {
    "curator()": {
     "kind": "eoa",
     "delegated_to": "0x63c0c19a282a1b52b07dd5a65b58948a07dae32b",
     "holder": "0xf630\u2026a997"
    }
   }
  },
  "ethereum-l1:0xbeef047a543e45807105e51a8bbefcc5950fcfba": {
   "roles": {
    "guardian()": {
     "kind": "contract",
     "holder": "0xaec761545fd135db6d04d27c92bcb3951668c67f"
    },
    "curator()": {
     "kind": "safe",
     "threshold": 3,
     "owners": 9,
     "holder": "0x827e…ecdb"
    }
   }
  },
  "ethereum-l1:0xbeef01735c132ada46aa9aa4c54623caa92a64cb": {
   "roles": {
    "guardian()": {
     "kind": "contract",
     "holder": "0xaa0500198b4425dfc4e272fbe42c8e64e21fc03d"
    },
    "curator()": {
     "kind": "safe",
     "threshold": 3,
     "owners": 9,
     "holder": "0x827e…ecdb"
    }
   }
  },
  "ethereum-l1:0xbeef088055857739c12cd3765f20b7679def0f51": {
   "roles": {
    "curator()": {
     "kind": "safe",
     "threshold": 3,
     "owners": 9,
     "holder": "0x827e…ecdb"
    }
   }
  },
  "ethereum-l1:0xbeef0c075da5d01112ae5cf34d257074fb5ddb2f": {
   "roles": {
    "curator()": {
     "kind": "safe",
     "threshold": 3,
     "owners": 9,
     "holder": "0x827e…ecdb"
    }
   }
  },
  "ethereum-l1:0xa0b86991c6218b36c1d19d4a2e9eb0ce3606eb48": {
   "roles": {
    "pauser()": {
     "kind": "eoa",
     "holder": "0x4914\u20268566"
    }
   }
  },
  "ethereum-l1:0x49048044d57e1c92a77f79988d21fa8faf74e97e": {
   "roles": {
    "guardian()": {
     "kind": "safe",
     "threshold": 2,
     "owners": 2,
     "holder": "0x7bb41c3008b3f03fe483b28b8db90e19cf07595c"
    }
   }
  },
  "monad:0x36878c6fca7e0e8a88f90dc410cfbbca5b695c95": {
   "roles": {
    "pauser()": {
     "kind": "contract",
     "holder": "0x574b7864119c9223a9870ea614dc91a8ee09e512"
    }
   }
  },
  "monad:0x32841a8511d5c2c5b253f45668780b99139e476d": {
   "roles": {
    "guardian()": {
     "kind": "safe",
     "threshold": 3,
     "owners": 9,
     "holder": "0x827e…ecdb"
    },
    "curator()": {
     "kind": "safe",
     "threshold": 3,
     "owners": 9,
     "holder": "0x827e…ecdb"
    }
   }
  },
  "plasma:0xa9c251f8304b1b3fc2b9e8fcae78d94eff82ac66": {
   "roles": {
    "curator()": {
     "kind": "safe",
     "threshold": 2,
     "owners": 5,
     "holder": "0x7d07…dcd8"
    }
   }
  },
  "robinhood:0xbeeff033f34c046626b8d0a041844c5d1a5409dd": {
   "roles": {
    "curator()": {
     "kind": "safe",
     "threshold": 3,
     "owners": 7,
     "holder": "0x9023…d2fb"
    }
   }
  },
  "robinhood:0x99347d5f70d3838763f6bddcf80304c8aa953b57": {
   "roles": {
    "curator()": {
     "kind": "safe",
     "threshold": 1,
     "owners": 1,
     "holder": "0x3bb7…5f42"
    }
   }
  },
  "robinhood:0x37788ff0c1d4e45a7fe06bc7e71e0cc00121d0a8": {
   "roles": {
    "curator()": {
     "kind": "safe",
     "threshold": 3,
     "owners": 5,
     "holder": "0x370e…134c"
    }
   }
  },
  "robinhood:0xbeeff0fb1dc19344a87b8479dab60a2e16160737": {
   "roles": {
    "curator()": {
     "kind": "safe",
     "threshold": 3,
     "owners": 7,
     "holder": "0x9023…d2fb"
    }
   }
  },
  "robinhood:0x026df18fbd2a7639089d0a16293383ec687a5ca1": {
   "roles": {
    "curator()": {
     "kind": "safe",
     "threshold": 2,
     "owners": 3,
     "holder": "0xe600…a4bb"
    }
   }
  },
  "robinhood:0x65dc90cd3a0bcde967c8ae6019d6790b616e78f7": {
   "roles": {
    "curator()": {
     "kind": "safe",
     "threshold": 2,
     "owners": 3,
     "holder": "0xe600…a4bb"
    }
   }
  },
  "robinhood:0xe129d4cb2d454c4acfac909d1576453a9b835f61": {
   "roles": {
    "curator()": {
     "kind": "safe",
     "threshold": 2,
     "owners": 3,
     "holder": "0xe600…a4bb"
    }
   }
  },
  "robinhood:0x292fc50e4eb66c3f6514b9e402dbc25961824d62": {
   "roles": {
    "pauser()": {
     "kind": "contract",
     "holder": "0x3e4adcf98e77f6d8022639f7135be4a3850033ed"
    }
   }
  },
  "robinhood:0xbeeff039907422219fb367e525954ddc092854d9": {
   "roles": {
    "curator()": {
     "kind": "safe",
     "threshold": 2,
     "owners": 2,
     "holder": "0x622e…c0fc"
    }
   }
  },
  "robinhood:0xbeefff136e3684273e6aa75a1669b784b373a4fd": {
   "roles": {
    "curator()": {
     "kind": "safe",
     "threshold": 3,
     "owners": 7,
     "holder": "0x9023…d2fb"
    }
   }
  },
  "tempo:0x9a044ae05e5e6290dcf56afd69548565e957a626": {
   "roles": {
    "curator()": {
     "kind": "safe",
     "threshold": 1,
     "owners": 1,
     "holder": "0x9e396de3312d373b87f9bd8763fb48184b42aac0"
    }
   }
  },
  "tempo:0x83a1491f3e7f8daab8f787a631334b9ca7a87023": {
   "roles": {
    "curator()": {
     "kind": "eoa",
     "holder": "0x445f\u20268dc9"
    }
   }
  },
  "tempo:0xc609656ed9ef219c98c8e549bf729144f211f06e": {
   "roles": {
    "curator()": {
     "kind": "safe",
     "threshold": 3,
     "owners": 7,
     "holder": "0x9e33faae38ff641094fa68c65c2ce600b3410585"
    }
   }
  }
 },
 "what": "the secondary roles of the tracked EVM contracts (pauser, guardian, curator, pauseGuardian, emergencyGuardian, emergencyAdmin) named by the getter that answered, who holds each (plain key shortened, Safe as threshold and count, timelock with its delay, contract) and the changes since the previous run; a call nobody answered keeps the previous role marked stale; read by scripts/side_roles.py"
}